{
  "$schema": "http://json-schema.org/draft-07/schema#",
  "$id": "https://dailyos.local/schemas/evaluation-evidence-record.v1.json",
  "title": "Evaluation Evidence Record v1",
  "type": "object",
  "additionalProperties": false,
  "allOf": [
    {
      "if": {
        "required": ["publishable"],
        "properties": {
          "publishable": {
            "const": true
          }
        }
      },
      "then": {
        "properties": {
          "privacy_class": {
            "const": "public"
          },
          "redaction_status": {
            "not": {
              "const": "blocked"
            }
          }
        }
      }
    },
    {
      "if": {
        "required": ["result"],
        "properties": {
          "result": {
            "const": "pass"
          }
        }
      },
      "then": {
        "properties": {
          "metrics": {
            "items": {
              "properties": {
                "status": {
                  "not": {
                    "const": "fail"
                  }
                }
              }
            }
          }
        }
      }
    },
    {
      "if": {
        "required": ["mode"],
        "properties": {
          "mode": {
            "const": "published"
          }
        }
      },
      "then": {
        "required": ["extensions"],
        "properties": {
          "metrics": {
            "minItems": 1
          },
          "artifact_paths": {
            "minItems": 1
          },
          "input_hashes": {
            "minProperties": 1,
            "anyOf": [
              {
                "required": ["schema"]
              },
              {
                "required": ["evaluation_evidence_schema"]
              }
            ]
          },
          "dataset_hash": {
            "$ref": "#/definitions/sha256"
          },
          "extensions": {
            "required": ["evidence_counts"],
            "properties": {
              "evidence_counts": {
                "anyOf": [
                  {
                    "required": ["record_count"],
                    "properties": {
                      "record_count": {
                        "minimum": 1
                      }
                    }
                  },
                  {
                    "required": ["fixture_count"],
                    "properties": {
                      "fixture_count": {
                        "minimum": 1
                      }
                    }
                  },
                  {
                    "required": ["bench_count"],
                    "properties": {
                      "bench_count": {
                        "minimum": 1
                      }
                    }
                  },
                  {
                    "required": ["sample_count"],
                    "properties": {
                      "sample_count": {
                        "minimum": 1
                      }
                    }
                  }
                ]
              }
            }
          }
        }
      }
    },
    {
      "if": {
        "required": ["mode", "suite"],
        "properties": {
          "mode": {
            "const": "published"
          },
          "suite": {
            "const": "suite_p"
          }
        }
      },
      "then": {
        "required": ["input_hashes", "extensions"],
        "properties": {
          "input_hashes": {
            "anyOf": [
              {
                "required": ["bench_manifest"]
              },
              {
                "required": ["bench_config"]
              }
            ]
          },
          "extensions": {
            "required": ["evidence_counts"],
            "properties": {
              "evidence_counts": {
                "required": ["bench_count"],
                "properties": {
                  "bench_count": {
                    "minimum": 1
                  }
                }
              }
            }
          }
        }
      }
    },
    {
      "if": {
        "required": ["mode", "suite"],
        "properties": {
          "mode": {
            "const": "published"
          },
          "suite": {
            "enum": ["abilities_eval", "gbrain_comparison"]
          }
        }
      },
      "then": {
        "required": ["input_hashes", "extensions"],
        "properties": {
          "input_hashes": {
            "anyOf": [
              {
                "required": ["fixture_manifest"]
              },
              {
                "required": ["corpus_manifest"]
              },
              {
                "required": ["dataset"]
              }
            ]
          },
          "extensions": {
            "required": ["evidence_counts"],
            "properties": {
              "evidence_counts": {
                "anyOf": [
                  {
                    "required": ["fixture_count"],
                    "properties": {
                      "fixture_count": {
                        "minimum": 1
                      }
                    }
                  },
                  {
                    "required": ["sample_count"],
                    "properties": {
                      "sample_count": {
                        "minimum": 1
                      }
                    }
                  }
                ]
              }
            }
          }
        }
      }
    },
    {
      "if": {
        "required": ["thresholds"],
        "properties": {
          "thresholds": {
            "required": ["requires_baseline"],
            "properties": {
              "requires_baseline": {
                "const": true
              }
            }
          }
        }
      },
      "then": {
        "anyOf": [
          {
            "required": ["input_hashes"],
            "properties": {
              "input_hashes": {
                "required": ["baseline"]
              }
            }
          },
          {
            "required": ["input_hashes"],
            "properties": {
              "input_hashes": {
                "required": ["prior_baseline"]
              }
            }
          },
          {
            "required": ["extensions"],
            "properties": {
              "extensions": {
                "required": ["baseline_binding"],
                "properties": {
                  "baseline_binding": {
                    "required": ["baseline_hash"]
                  }
                }
              }
            }
          }
        ]
      }
    }
  ],
  "required": [
    "schema_version",
    "suite",
    "lane",
    "mode",
    "scope",
    "run_id",
    "commit",
    "branch",
    "dirty",
    "command",
    "started_at",
    "finished_at",
    "environment",
    "input_hashes",
    "metric_definitions",
    "metrics",
    "thresholds",
    "result",
    "artifact_paths",
    "privacy_class",
    "publishable",
    "dataset_source",
    "dataset_license",
    "dataset_hash",
    "redaction_status",
    "notes"
  ],
  "properties": {
    "schema_version": {
      "const": "evaluation_evidence_record_v1"
    },
    "suite": {
      "type": "string",
      "enum": [
        "suite_p",
        "suite_s",
        "suite_e",
        "abilities_eval",
        "gbrain_comparison",
        "release_gate",
        "custom"
      ]
    },
    "lane": {
      "type": "string",
      "minLength": 1
    },
    "mode": {
      "type": "string",
      "enum": ["smoke", "published", "manual", "ci", "dry_run"]
    },
    "scope": {
      "type": "string",
      "minLength": 1
    },
    "run_id": {
      "type": "string",
      "minLength": 1
    },
    "commit": {
      "type": "string",
      "minLength": 7
    },
    "branch": {
      "type": "string",
      "minLength": 1
    },
    "dirty": {
      "type": "boolean"
    },
    "command": {
      "type": "string",
      "minLength": 1
    },
    "started_at": {
      "type": "string",
      "pattern": "^\\d{4}-\\d{2}-\\d{2}T\\d{2}:\\d{2}:\\d{2}(?:\\.\\d+)?(?:Z|[+-]\\d{2}:\\d{2})$",
      "format": "date-time"
    },
    "finished_at": {
      "type": "string",
      "pattern": "^\\d{4}-\\d{2}-\\d{2}T\\d{2}:\\d{2}:\\d{2}(?:\\.\\d+)?(?:Z|[+-]\\d{2}:\\d{2})$",
      "format": "date-time"
    },
    "environment": {
      "type": "object",
      "additionalProperties": {
        "type": ["string", "number", "boolean", "null"]
      }
    },
    "input_hashes": {
      "type": "object",
      "additionalProperties": {
        "$ref": "#/definitions/sha256"
      }
    },
    "metric_definitions": {
      "type": "array",
      "items": {
        "$ref": "#/definitions/metric_definition"
      }
    },
    "metrics": {
      "type": "array",
      "items": {
        "$ref": "#/definitions/metric"
      }
    },
    "thresholds": {
      "type": "object",
      "properties": {
        "requires_baseline": {
          "type": "boolean"
        }
      },
      "additionalProperties": {
        "type": "object",
        "additionalProperties": false,
        "required": ["operator", "value"],
        "properties": {
          "operator": {
            "type": "string",
            "enum": ["eq", "neq", "lt", "lte", "gt", "gte"]
          },
          "value": true
        }
      }
    },
    "result": {
      "type": "string",
      "enum": ["pass", "fail", "blocked", "not_run"]
    },
    "artifact_paths": {
      "type": "array",
      "items": {
        "$ref": "#/definitions/artifact_path"
      }
    },
    "privacy_class": {
      "type": "string",
      "enum": ["public", "internal", "private", "restricted"]
    },
    "publishable": {
      "type": "boolean"
    },
    "dataset_source": {
      "type": "string",
      "minLength": 1
    },
    "dataset_license": {
      "type": "string",
      "minLength": 1
    },
    "dataset_hash": {
      "$ref": "#/definitions/sha256"
    },
    "redaction_status": {
      "type": "string",
      "enum": ["synthetic", "redacted", "reviewed", "blocked"]
    },
    "notes": {
      "type": "string",
      "minLength": 1
    },
    "extensions": {
      "type": "object",
      "allOf": [
        {
          "$ref": "#/definitions/extension_object"
        }
      ],
      "properties": {
        "evidence_counts": {
          "$ref": "#/definitions/evidence_counts"
        },
        "baseline_binding": {
          "$ref": "#/definitions/baseline_binding"
        }
      },
      "additionalProperties": {
        "$ref": "#/definitions/extension_value"
      }
    }
  },
  "definitions": {
    "extension_object": {
      "type": "object",
      "propertyNames": {
        "$ref": "#/definitions/extension_key"
      },
      "additionalProperties": {
        "$ref": "#/definitions/extension_value"
      }
    },
    "extension_value": {
      "anyOf": [
        {
          "type": ["string", "number", "boolean", "null"]
        },
        {
          "type": "array",
          "items": {
            "$ref": "#/definitions/extension_value"
          }
        },
        {
          "$ref": "#/definitions/extension_object"
        }
      ]
    },
    "extension_key": {
      "not": {
        "pattern": "^(?:.*(?:prompt|Prompt|message|Message|transcript|Transcript|payload|Payload).*$|.*(?:raw|Raw|judge|Judge|llm|LLM|model|Model).*(?:output|Output).*$|(?:raw|Raw|unreviewed|Unreviewed).*)$"
      }
    },
    "metric_definition": {
      "type": "object",
      "additionalProperties": false,
      "required": ["namespace", "name", "description", "unit", "higher_is_better"],
      "properties": {
        "namespace": {
          "$ref": "#/definitions/metric_namespace"
        },
        "name": {
          "type": "string",
          "minLength": 1
        },
        "description": {
          "type": "string",
          "minLength": 1
        },
        "unit": {
          "type": "string",
          "minLength": 1
        },
        "higher_is_better": {
          "type": "boolean"
        }
      }
    },
    "metric": {
      "type": "object",
      "additionalProperties": false,
      "required": ["namespace", "name", "value", "unit", "status"],
      "properties": {
        "namespace": {
          "$ref": "#/definitions/metric_namespace"
        },
        "name": {
          "type": "string",
          "minLength": 1
        },
        "value": {
          "type": ["number", "boolean", "string", "null"]
        },
        "unit": {
          "type": "string",
          "minLength": 1
        },
        "status": {
          "type": "string",
          "enum": ["pass", "fail", "warn", "info", "not_applicable"]
        }
      }
    },
    "artifact_path": {
      "type": "object",
      "additionalProperties": false,
      "allOf": [
        {
          "if": {
            "required": ["publishable"],
            "properties": {
              "publishable": {
                "const": true
              }
            }
          },
          "then": {
            "properties": {
              "privacy_class": {
                "const": "public"
              },
              "redaction_status": {
                "not": {
                  "const": "blocked"
                }
              }
            }
          }
        }
      ],
      "required": ["path", "kind", "privacy_class", "publishable", "redaction_status"],
      "properties": {
        "path": {
          "type": "string",
          "minLength": 1,
          "pattern": "^(?![A-Za-z]:)(?!\\\\)(?!//)(?!/)(?!~)(?!file://)(?!.*(?:^|[\\\\/])\\.\\.(?:[\\\\/]|$))(?!.*(?:^|[\\\\/])(?:Users|home)[\\\\/])(?!.*(?:^|[\\\\/])(?:private[\\\\/]var|var[\\\\/]folders)(?:[\\\\/]|$))(?!.*(?:^|[\\\\/])\\.dailyos(?:[\\\\/]|$))(?!.*(?:^|[\\\\/])(?:\\.ssh[\\\\/]config|\\.aws[\\\\/]credentials|\\.cargo[\\\\/]credentials(?:\\.toml)?)(?:[\\\\/]|$))(?!.*(?:^|[\\\\/])(?:fixture_identity_map|identity_map|id_rsa|id_ed25519|\\.env(?:\\.[A-Za-z0-9_-]+)?|\\.netrc|\\.npmrc|\\.pypirc|\\.git-credentials|credentials\\.json|secrets\\.json)(?:[\\\\/]|$)).+"
        },
        "kind": {
          "type": "string",
          "minLength": 1
        },
        "sha256": {
          "$ref": "#/definitions/sha256"
        },
        "privacy_class": {
          "type": "string",
          "enum": ["public", "internal", "private", "restricted"]
        },
        "publishable": {
          "type": "boolean"
        },
        "redaction_status": {
          "type": "string",
          "enum": ["synthetic", "redacted", "reviewed", "blocked"]
        }
      }
    },
    "metric_namespace": {
      "type": "string",
      "enum": [
        "performance_regression",
        "retrieval",
        "answer_quality",
        "provenance_quality",
        "temporal_correctness",
        "trust_band_correctness",
        "surface_safety",
        "public_comparison"
      ]
    },
    "evidence_counts": {
      "type": "object",
      "additionalProperties": false,
      "properties": {
        "record_count": {
          "type": "integer",
          "minimum": 0
        },
        "fixture_count": {
          "type": "integer",
          "minimum": 0
        },
        "bench_count": {
          "type": "integer",
          "minimum": 0
        },
        "sample_count": {
          "type": "integer",
          "minimum": 0
        }
      }
    },
    "baseline_binding": {
      "type": "object",
      "additionalProperties": {
        "$ref": "#/definitions/sha256"
      }
    },
    "sha256": {
      "type": "string",
      "pattern": "^sha256:[0-9a-f]{64}$"
    }
  }
}
